ID,Brand,Category,Gender,Name,Image URL,Price
0,Saint Laurent,Shirts,Men,saint laurent hawaiian shirt,https://saint-laurent.dam.kering.com/m/2631b1a702cbfe1b/Thumbnail-638555Y01FB9755_A.jpg?v=4,5990
1,Saint Laurent,Shirts,Men,shirt in striated silk voile,https://saint-laurent.dam.kering.com/m/7dcaa7547dcca0f6/Thumbnail-644680Y2C811000_A.jpg?v=2,8900
2,Saint Laurent,Shirts,Men,shark-collar shirt in tropical silk crepe de chine,https://saint-laurent.dam.kering.com/m/28c9a6c5f593ecde/Thumbnail-531956Y2C639787_A.jpg?v=2,8500
3,Saint Laurent,Shirts,Men,shirt in confetti hibiscus silk crepe de chine,https://saint-laurent.dam.kering.com/m/79375044f590a12e/Thumbnail-601070Y2C351093_A.jpg?v=2,7900
4,Saint Laurent,Shirts,Men,shirt in tropical silk crepe de chine,https://saint-laurent.dam.kering.com/m/38892b6d5062f230/Thumbnail-601070Y2C631097_A.jpg?v=2,7900
5,Saint Laurent,Shirts,Men,shark-collar shirt in dotted leaf viscose,https://saint-laurent.dam.kering.com/m/38d5fb554faaaa46/Thumbnail-531956Y2C261095_A.jpg?v=2,5990
6,Saint Laurent,Shirts,Men,shark-collar shirt in wild orchid viscose,https://saint-laurent.dam.kering.com/m/d17bf69408d4846/Thumbnail-531956Y2C917067_A.jpg?v=2,5990
7,Saint Laurent,Shirts,Men,embroidered tunic in cupro satin voile,https://saint-laurent.dam.kering.com/m/573e748aa2f8874c/Thumbnail-643134Y532U9601_A.jpg?v=2,9500
8,Saint Laurent,Shirts,Men,shirt in iridescent silk shantung,https://saint-laurent.dam.kering.com/m/dee327d369e5dcc/Thumbnail-601070Y1C073024_A.jpg?v=2,5990
9,Saint Laurent,Shirts,Men,shawl-collar shirt in striped chenille voile,https://saint-laurent.dam.kering.com/m/1a661bdc4a6616b4/Thumbnail-637283Y1C289073_A.jpg?v=2,5990
10,Saint Laurent,Shirts,Men,shark-collar shirt in shiny and matte leopard silk,https://saint-laurent.dam.kering.com/m/5d77a4bbd05dc104/Thumbnail-531956Y2B191000_A.jpg?v=1,10500
11,Saint Laurent,Shirts,Men,short tunic in silk parasol jacquard,https://saint-laurent.dam.kering.com/m/132be7b23fcd57c1/Thumbnail-642424Y2C761000_A.jpg?v=2,8900
12,Saint Laurent,Shirts,Men,long boxy shirt in jungle silk jacquard,https://saint-laurent.dam.kering.com/m/63381db294b9e655/Thumbnail-643638Y2C371000_A.jpg?v=2,13500
13,Saint Laurent,Shirts,Men,oversized hawaiian long shirt,https://saint-laurent.dam.kering.com/m/2a60a0002780e123/Thumbnail-644066Y01FA9750_A.jpg?v=2,8500
14,Saint Laurent,Shirts,Men,long shirt in lamé pineapple jacquard ,https://saint-laurent.dam.kering.com/m/d0337eade4eba22/Thumbnail-642420Y2C461055_A.jpg?v=2,20900
15,Saint Laurent,Shirts,Men,shirt in cotton poplin,https://saint-laurent.dam.kering.com/m/190badfeb06910b/Thumbnail-504094Y271W9000_A.jpg?v=1,4450
16,Saint Laurent,Shirts,Men,western shirt in silk parasol jacquard,https://saint-laurent.dam.kering.com/m/6fbd7ff6b4efa688/Thumbnail-642421Y2C761000_A.jpg?v=2,9500
17,Saint Laurent,Shirts,Men,wild orchid shirt in silk crepe de chine,https://saint-laurent.dam.kering.com/m/3e3c107d835c2bc4/Thumbnail-646850Y2C161095_A.jpg?v=2,8900
18,Saint Laurent,Shirts,Men,parasol shirt in silk jacquard,https://saint-laurent.dam.kering.com/m/244af18edbbac0b2/Thumbnail-646850Y2C761000_A.jpg?v=2,8900
19,Saint Laurent,Shirts,Men,pointillism shirt in silk satin,https://saint-laurent.dam.kering.com/m/634c36792413c81f/Thumbnail-646850Y2C289506_A.jpg?v=2,8500
20,Saint Laurent,Shirts,Men,shirt in striped twill,https://saint-laurent.dam.kering.com/m/235d5cc30dbecbf1/Thumbnail-564172Y1B899787_A.jpg?v=3,4990
21,Saint Laurent,Shirts,Men,triple-stripe shirt in shiny and matte silk,https://saint-laurent.dam.kering.com/m/113f4b1887ba9cfe/Thumbnail-621595Y1B231095_A.jpg?v=3,9800
22,Saint Laurent,Shirts,Men,shirt in striped cotton piqué,https://saint-laurent.dam.kering.com/m/5ad8eca10a6d2c3f/Thumbnail-564269Y1B859000_A.jpg?v=4,4390
23,Saint Laurent,Shirts,Men,yves collar shirt in cotton poplin,https://saint-laurent.dam.kering.com/m/75e32cd55b7f362f/Thumbnail-564269Y217W9000_A.jpg?v=1,4450
24,Saint Laurent,Shirts,Men,anchor shirt in silk crepe de chine,https://saint-laurent.dam.kering.com/m/65a66b562752ca49/Thumbnail-564172Y5B061095_A.jpg?v=3,8500
25,Saint Laurent,Shirts,Men,shirt in cotton poplin,https://saint-laurent.dam.kering.com/m/4dcd37c98ff50e42/Thumbnail-535293Y217W9000_A.jpg?v=1,4450
26,Saint Laurent,Shirts,Men,western shirt in dotted silk satin,https://saint-laurent.dam.kering.com/m/4d902ef99ae2d5/Thumbnail-642421Y2C991095_A.jpg?v=2,8900
27,Saint Laurent,Shirts,Men,western shirt in dotted silk satin,https://saint-laurent.dam.kering.com/m/7dab5c167ac3c8bc/Thumbnail-642421Y2C284063_A.jpg?v=2,8900
28,Saint Laurent,Shirts,Men,shirt in striated cotton,https://saint-laurent.dam.kering.com/m/1ce5053372b8c76e/Thumbnail-646850Y1C099601_A.jpg?v=2,4990
29,Saint Laurent,Shirts,Men,classic shirt in dotted crepe de chine,https://saint-laurent.dam.kering.com/m/5fcf27d338f1efae/Thumbnail-646850Y301W1000_A.jpg?v=2,8900
30,Saint Laurent,Shirts,Men,shirt in cotton poplin,https://saint-laurent.dam.kering.com/m/30d0394f64f833d0/Thumbnail-535293Y217W1000_A.jpg?v=1,4450
31,Saint Laurent,Shirts,Men,saint laurent-embroidered overshirt in tartan flannel,https://saint-laurent.dam.kering.com/m/173444a09b118b72/Thumbnail-636581Y2B376278_A.jpg?v=5,7900
32,Saint Laurent,Shirts,Men,pique plastron yves collar shirt in white cotton poplin,https://saint-laurent.dam.kering.com/m/7f76591d6b5d4c07/Thumbnail-504104Y216W9000_A.jpg?v=8,5690
33,Saint Laurent,Shirts,Men,yves collar shirt in cotton poplin,https://saint-laurent.dam.kering.com/m/1de17e03542c95b6/Thumbnail-564269Y217W1000_A.jpg?v=1,4450
34,Saint Laurent,Jumpers,Men,destroyed knit stripe sweater in linen and brushed mohair,https://saint-laurent.dam.kering.com/m/4425a0ec5811313a/Thumbnail-646162YAWI29568_A.jpg?v=2,8500
35,Saint Laurent,Jumpers,Men,wool sweater,https://saint-laurent.dam.kering.com/m/641c340aebbc6465/Thumbnail-603088YALK22611_A.jpg?v=2,6550
36,Saint Laurent,Jumpers,Men,cashmere sweater,https://saint-laurent.dam.kering.com/m/3e4fbeac7a9674ee/Thumbnail-603087YALJ21000_A.jpg?v=1,9500
37,Saint Laurent,Jumpers,Men,cashmere sweater,https://saint-laurent.dam.kering.com/m/72066933db66a463/Thumbnail-603087YALJ29502_A.jpg?v=1,9500
38,Saint Laurent,Jumpers,Men,cashmere sweater,https://saint-laurent.dam.kering.com/m/71ac118d78083bfc/Thumbnail-603089YALL21000_A.jpg?v=1,7900
39,Saint Laurent,Jumpers,Men,destroyed oversized sweater in graphic jacquard,https://saint-laurent.dam.kering.com/m/2afdc54a85243861/Thumbnail-645962YAVY29744_A.jpg?v=2,7900
40,Saint Laurent,Jumpers,Men,semi-sheer sweater in tropical jacquard,https://saint-laurent.dam.kering.com/m/3045c43c8e9282e0/Thumbnail-645779YAWQ29744_A.jpg?v=2,8500
41,Saint Laurent,Jumpers,Men,wide-neck sweater in striped lamé knit,https://saint-laurent.dam.kering.com/m/6e95220de86da7bd/Thumbnail-645959YAVT21043_A.jpg?v=2,6290
42,Saint Laurent,Jumpers,Men,wool turtleneck sweater,https://saint-laurent.dam.kering.com/m/752759cf274a87ee/Thumbnail-631861YALK22611_A.jpg?v=3,7200
43,Saint Laurent,Jumpers,Men,wool turtleneck sweater,https://saint-laurent.dam.kering.com/m/231d93c2e83eff1f/Thumbnail-635485YALK21140_A.jpg?v=3,7200
44,Saint Laurent,Jumpers,Men,turtleneck sweater in flecked wool and cashmere,https://saint-laurent.dam.kering.com/m/44ae81b7c3d59068/Thumbnail-633192YASS21104_A.jpg?v=3,9500
45,Saint Laurent,Jumpers,Men,turtleneck sweater in cashmere saint laurent,https://saint-laurent.dam.kering.com/m/5d90c84bb3a4633/Thumbnail-631860YALJ21000_A.jpg?v=4,9800
46,Saint Laurent,Jumpers,Men,baja cardigan hoodie in striped dégradé knit crochet,https://saint-laurent.dam.kering.com/m/2a17379a6b4f049c/Thumbnail-648517YAWV23278_A.jpg?v=2,11500
47,Saint Laurent,Jumpers,Men,round-neck sweater in flecked wool and cashmere,https://saint-laurent.dam.kering.com/m/77547323989e4707/Thumbnail-633190YASS21104_A.jpg?v=3,8900
48,Saint Laurent,Jumpers,Men,round-neck wool sweater,https://saint-laurent.dam.kering.com/m/5a783c1b7fcf555b/Thumbnail-631859YALK21140_A.jpg?v=4,6290
49,Saint Laurent,Jumpers,Men,sailor knit sweater in wool and mohair,https://saint-laurent.dam.kering.com/m/3a114fb542272859/Thumbnail-631503YARG21000_A.jpg?v=4,8500
50,Saint Laurent,Jumpers,Men,high-neck sweater with buttons,https://saint-laurent.dam.kering.com/m/18a96e2b91013f4/Thumbnail-603091YALM24240_A.jpg?v=1,8500
51,Saint Laurent,Jumpers,Men,wool and cotton sweater,https://saint-laurent.dam.kering.com/m/386f69324acc5a1f/Thumbnail-588063YAFQ21095_A.jpg?v=2,7900
52,Saint Laurent,Jumpers,Men,knit kimono in abstract tiger jacquard,https://saint-laurent.dam.kering.com/m/67fd65e17c7e8e52/Thumbnail-644663YAWU21026_A.jpg?v=2,15900
53,Saint Laurent,Jeans,Men,jacket in lightly coated black stretch denim,https://saint-laurent.dam.kering.com/m/97141ec7e2275fd/Thumbnail-597064Y500A1251_A.jpg,8500
54,Saint Laurent,Jeans,Men,jacket in lightly coated black stretch denim,https://saint-laurent.dam.kering.com/m/38b726f39824dd5b/Thumbnail-597064YZ8901251_A.jpg?v=6,8500
55,Saint Laurent,Jeans,Men,fitted jacket in worn black denim,https://saint-laurent.dam.kering.com/m/4b810aea5fe65c54/Thumbnail-597085YF8991220_A.jpg?v=3,8500
56,Saint Laurent,Jeans,Men,denim jacket with a used look and shearling collar,https://saint-laurent.dam.kering.com/m/3b3442ab6f0155d3/Thumbnail-579527YX8991220_A.jpg,19900
57,Saint Laurent,Jeans,Men,jacket with shearling in worn black denim,https://saint-laurent.dam.kering.com/m/2ef5388e30e89c0b/Thumbnail-652845Y18FA1220_A.jpg?v=3,20900
58,Saint Laurent,Jeans,Men,jacket with shearling in dark dirty vintage blue denim,https://saint-laurent.dam.kering.com/m/5c3264b78b881fc4/Thumbnail-652845Y19FA4160_A.jpg?v=3,20900
59,Saint Laurent,Jeans,Men,jacket with shearling collar in used 70’s blue denim,https://saint-laurent.dam.kering.com/m/284ecfbceebbdcdd/Thumbnail-561158YY8834621_A.jpg?v=1,20900
60,Saint Laurent,Jeans,Men,destroyed jacket in sky blue denim,https://saint-laurent.dam.kering.com/m/5bef1da0c9ef87ca/Thumbnail-627584Y820L4669_A.jpg?v=2,9500
61,Saint Laurent,Jeans,Men,fitted jacket in dirty sandy blue denim,https://saint-laurent.dam.kering.com/m/4420d3f55b19c397/Thumbnail-597085Y502V4781_A.jpg?v=2,8900
62,Saint Laurent,Jeans,Men,fitted jacket in dark dirty vintage blue denim,https://saint-laurent.dam.kering.com/m/4affc76f84b9124d/Thumbnail-597085YYS074160_A.jpg?v=3,8900
63,Saint Laurent,Jeans,Men,classic jacket in deep vintage blue denim,https://saint-laurent.dam.kering.com/m/3efdde0e3f94493f/Thumbnail-597064YC8684255_A.jpg?v=3,8900
64,Saint Laurent,Jeans,Men,destroyed jean jacket in repaired dirty blue denim,https://saint-laurent.dam.kering.com/m/481ea5a7da7c3e30/Thumbnail-651610Y32AB4015_A.jpg?v=2,9500
65,Saint Laurent,Jeans,Men,destroyed fitted jacket in rodeo blue denim,https://saint-laurent.dam.kering.com/m/17765e4043d804b8/Thumbnail-601710Y883Y4501_A.jpg?v=1,8900
66,Saint Laurent,Jeans,Men,destroyed jacket in '70s blue trash denim,https://saint-laurent.dam.kering.com/m/18284e330db1e7d5/Thumbnail-596908YE9574342_A.jpg?v=3,13500
67,Saint Laurent,Jeans,Men,50s jacket in sun dirty blue denim,https://saint-laurent.dam.kering.com/m/631b5086cc174d5b/Thumbnail-625282Y00WA4987_A.jpg?v=2,13500
68,Saint Laurent,Jeans,Men,fitted jacket in gray off-white denim,https://saint-laurent.dam.kering.com/m/62c606d1248ddb91/Thumbnail-597085Y01KB9029_A.jpg?v=3,9800
69,Saint Laurent,Jeans,Men,fitted jacket in blue and pink dégradé denim,https://saint-laurent.dam.kering.com/m/16a3411b3bf8a130/Thumbnail-597085Y02IA4021_A.jpg?v=2,9500
70,Saint Laurent,Jeans,Men,western shirt in dirty medium vintage blue,https://saint-laurent.dam.kering.com/m/b2a221d09fd8e02/Thumbnail-498101Y880L4363_A.jpg,4990
71,Saint Laurent,Jeans,Men,western shirt in deep vintage blue denim,https://saint-laurent.dam.kering.com/m/2dea7b60e455d9c4/Thumbnail-597059Y880U4255_A.jpg?v=3,5590
72,Saint Laurent,Jeans,Men,classic western shirt in lightly coated black denim,https://saint-laurent.dam.kering.com/m/45598a402586e7b5/Thumbnail-597061Y881U1251_A.jpg,6290
73,Saint Laurent,Jeans,Men,western shirt in black rinse denim,https://saint-laurent.dam.kering.com/m/33178d765ab38e7c/Thumbnail-597059YM8811078_A.jpg?v=3,4990
74,Saint Laurent,Jeans,Men,western shirt in beige stonewashed denim,https://saint-laurent.dam.kering.com/m/ab33f48eac23ac7/Thumbnail-597059Y27BB9241_A.jpg?v=3,5590
75,Saint Laurent,Jeans,Men,western shirt in khaki stonewashed denim,https://saint-laurent.dam.kering.com/m/7613eee89eb49d56/Thumbnail-597059Y27BA3256_A.jpg?v=4,5590
76,Saint Laurent,Jeans,Men,distressed classic western shirt in khaki stonewashed denim,https://saint-laurent.dam.kering.com/m/18694c8ec07f3f99/Thumbnail-629966Y596V3253_A.jpg?v=3,5990
77,Saint Laurent,Jeans,Men,distressed western shirt in dirty sky blue denim,https://saint-laurent.dam.kering.com/m/2bc240a703161a6a/Thumbnail-651162Y24AB4679_A.jpg?v=2,6290
78,Saint Laurent,Jeans,Men,western shirt in dirty light blue stonewashed chambray,https://saint-laurent.dam.kering.com/m/7544a3634bcc33ca/Thumbnail-597059Y01IC4027_A.jpg?v=2,4690
79,Saint Laurent,Jeans,Men,long shirt in blue-gray vintage denim,https://saint-laurent.dam.kering.com/m/47b7647126db8a75/Thumbnail-652047Y02GA4018_A.jpg?v=2,4390
80,Saint Laurent,Jeans,Men,army shirt in wool check,https://saint-laurent.dam.kering.com/m/77ea8f1a1cf658a0/Thumbnail-637169Y00JA9704_A.jpg?v=2,5990
81,Saint Laurent,Jeans,Men,western shirt in vintage floral ikat cotton,https://saint-laurent.dam.kering.com/m/4b3fec0e3bc52c8/Thumbnail-644064Y01HA9757_A.jpg?v=2,5990
82,Saint Laurent,Jeans,Men,straight-fit jeans in dyed black denim,https://saint-laurent.dam.kering.com/m/29e7d1e29767394b/Thumbnail-625675Y867C1762_A.jpg?v=2,4990
83,Saint Laurent,Jeans,Men,skinny-fit jeans in used black denim,https://saint-laurent.dam.kering.com/m/33e20fbfcaeb74ba/Thumbnail-527389YO5001080_A.jpg?v=4,4690
84,Saint Laurent,Jeans,Men,skinny-fit jeans in silver-coated black stretch denim,https://saint-laurent.dam.kering.com/m/202cb0181f1c9e81/Thumbnail-622876Y500R1770_A.jpg?v=3,4990
85,Saint Laurent,Jeans,Men,skinny jeans in lightly coated black stretch denim,https://saint-laurent.dam.kering.com/m/7c74b142dcaf3a19/Thumbnail-622876YZ8901251_A.jpg?v=2,5990
86,Saint Laurent,Jeans,Men,skinny-fit jeans in worn black stretch denim,https://saint-laurent.dam.kering.com/m/6ea83940b6258061/Thumbnail-527389YS5001220_A.jpg?v=3,4390
87,Saint Laurent,Jeans,Men,slim-fit jeans in worn black stretch denim,https://saint-laurent.dam.kering.com/m/700cd6d077e99402/Thumbnail-526881YF8991220_A.jpg?v=1,4390
88,Saint Laurent,Jeans,Men,skinny-fit jeans in coated black denim,https://saint-laurent.dam.kering.com/m/1f2d4462f2a4c6b6/Thumbnail-527389Y824K1076_A.jpg,4690
89,Saint Laurent,Jeans,Men,cropped skinny-fit jeans in used black stretch denim,https://saint-laurent.dam.kering.com/m/5faad3ac3eeb265c/Thumbnail-601478YO5001080_A.jpg,4690
90,Saint Laurent,Jeans,Men,slim-fit jeans in worn black denim,https://saint-laurent.dam.kering.com/m/33008c4f229924a9/Thumbnail-597052YF8991220_A.jpg?v=3,4390
91,Saint Laurent,Jeans,Men,carrot-fit jeans in used black denim,https://saint-laurent.dam.kering.com/m/a4c5b3b18b1999c/Thumbnail-644678YY8991080_A.jpg?v=2,5590
92,Saint Laurent,Jeans,Men,slim-fit jeans in vintage dirty gray denim,https://saint-laurent.dam.kering.com/m/767f17a4aad957da/Thumbnail-597052Y823D1284_A.jpg?v=2,5990
93,Saint Laurent,Jeans,Men,tokyo black stretch denim skinny jeans,https://saint-laurent.dam.kering.com/m/54ab93ebdae65c43/Thumbnail-548400YT5001160_A.jpg?v=2,5550
94,Saint Laurent,Jeans,Men,slim-fit jeans in indigo raw denim,https://saint-laurent.dam.kering.com/m/3b7eef13cd1dcf0d/Thumbnail-597052YG8064020_A.jpg?v=1,4990
95,Saint Laurent,Jeans,Men,skinny-fit jeans in blue moon stretch denim,https://saint-laurent.dam.kering.com/m/75aa60dc5fdb84d3/Thumbnail-602817YD9934406_A.jpg,5990
96,Saint Laurent,Jeans,Men,slim-fit jeans in indigo sky blue denim,https://saint-laurent.dam.kering.com/m/3b60fee71cbfd8cd/Thumbnail-597052Y372E4116_A.jpg?v=1,5990
97,Saint Laurent,Jeans,Men,skinny-fit jeans in dirty 90's vintage blue denim,https://saint-laurent.dam.kering.com/m/36567baa06b9f836/Thumbnail-527389YA8624418_A.jpg,4990
98,Saint Laurent,Jeans,Men,skinny-fit jeans in dirty old vintage blue denim,https://saint-laurent.dam.kering.com/m/af9e8beea3c7d7a/Thumbnail-527389YB4774418_A.jpg?v=3,5990
99,Saint Laurent,Jeans,Men,slim-fit jeans in dirty sandy blue denim,https://saint-laurent.dam.kering.com/m/1769222b18c27415/Thumbnail-597052Y502V4781_A.jpg?v=2,5590
100,Saint Laurent,Jeans,Men,slim-fit jeans in santa monica blue denim,https://saint-laurent.dam.kering.com/m/3e44561e33139ec1/Thumbnail-597052YM3724568_A.jpg?v=2,5590
101,Saint Laurent,Jeans,Men,low-waisted skinny jeans in bright blue comfort stretch denim,https://saint-laurent.dam.kering.com/m/4b9186ae2b67363/Thumbnail-597032YO5074741_A.jpg,5590
102,Saint Laurent,Jeans,Men,skinny-fit jeans in dark used blue denim,https://saint-laurent.dam.kering.com/m/592219caefb48486/Thumbnail-527389YD8624512_A.jpg,4990
103,Saint Laurent,Jeans,Men,slim-fit jeans in hawaii blue denim,https://saint-laurent.dam.kering.com/m/a7b26b251f1d22b/Thumbnail-597052Y372Y4681_A.jpg?v=3,5990
104,Saint Laurent,Jeans,Men,slim-fit jeans in light fall blue denim,https://saint-laurent.dam.kering.com/m/678a0900b197aaa8/Thumbnail-597052Y372Z4998_A.jpg?v=1,5990
105,Saint Laurent,Jeans,Men,skinny-fit jeans in santa monica blue denim,https://saint-laurent.dam.kering.com/m/77066ca67dbb6238/Thumbnail-527389YJ5074568_A.jpg?v=3,5590
106,Saint Laurent,Jeans,Men,slim-fit jeans in 80's vintage blue denim,https://saint-laurent.dam.kering.com/m/efa109644f5e54c/Thumbnail-597052YD3724503_A.jpg?v=1,5990
107,Saint Laurent,Jeans,Men,carrot-fit jeans in light fall blue denim,https://saint-laurent.dam.kering.com/m/49f686db5359bf07/Thumbnail-644678Y372Z4998_A.jpg?v=2,5990
108,Saint Laurent,Jeans,Men,carrot-fit jeans in gray off-white denim,https://saint-laurent.dam.kering.com/m/2783d3eea28fe686/Thumbnail-644678Y01KB9029_A.jpg?v=3,6290
109,Saint Laurent,Jeans,Men,slim-fit jeans in grey off-white denim,https://saint-laurent.dam.kering.com/m/9f0e00ff8bf78d5/Thumbnail-597052Y01KB9029_A.jpg?v=1,6290
110,Saint Laurent,Jeans,Men,straight-cut jeans in gray super bleach white denim,https://saint-laurent.dam.kering.com/m/2f738b9fff582493/Thumbnail-651900Y01KA9028_A.jpg?v=4,6290
111,Saint Laurent,Jeans,Men,slim-fit jeans in white stonewashed denim,https://saint-laurent.dam.kering.com/m/5cf3f0973b2ae6d8/Thumbnail-597052YR8889001_A.jpg?v=3,4390
112,Saint Laurent,Jeans,Men,destroyed california shorts in repaired dirty blue denim,https://saint-laurent.dam.kering.com/m/6360c29891543924/Thumbnail-643542Y32AB4015_A.jpg?v=6,4990
113,Saint Laurent,Jeans,Men,raw-edge shorts in leopard-print denim,https://saint-laurent.dam.kering.com/m/2ab858f20ac09725/Thumbnail-638547Y823E7401_A.jpg?v=3,4990
114,Saint Laurent,Jeans,Men,raw-edge shorts in blue and pink dégradé denim,https://saint-laurent.dam.kering.com/m/2c60fc271b091c81/Thumbnail-648466Y02IA4021_A.jpg?v=2,5590
115,Saint Laurent,T-Shirts,Men,jacket in lightly coated black stretch denim,https://saint-laurent.dam.kering.com/m/97141ec7e2275fd/Thumbnail-597064Y500A1251_A.jpg,8500
116,Saint Laurent,T-Shirts,Men,jacket in lightly coated black stretch denim,https://saint-laurent.dam.kering.com/m/38b726f39824dd5b/Thumbnail-597064YZ8901251_A.jpg?v=6,8500
117,Saint Laurent,T-Shirts,Men,fitted jacket in worn black denim,https://saint-laurent.dam.kering.com/m/4b810aea5fe65c54/Thumbnail-597085YF8991220_A.jpg?v=3,8500
118,Saint Laurent,T-Shirts,Men,denim jacket with a used look and shearling collar,https://saint-laurent.dam.kering.com/m/3b3442ab6f0155d3/Thumbnail-579527YX8991220_A.jpg,19900
119,Saint Laurent,T-Shirts,Men,jacket with shearling in worn black denim,https://saint-laurent.dam.kering.com/m/2ef5388e30e89c0b/Thumbnail-652845Y18FA1220_A.jpg?v=3,20900
120,Saint Laurent,T-Shirts,Men,jacket with shearling in dark dirty vintage blue denim,https://saint-laurent.dam.kering.com/m/5c3264b78b881fc4/Thumbnail-652845Y19FA4160_A.jpg?v=3,20900
121,Saint Laurent,T-Shirts,Men,jacket with shearling collar in used 70’s blue denim,https://saint-laurent.dam.kering.com/m/284ecfbceebbdcdd/Thumbnail-561158YY8834621_A.jpg?v=1,20900
122,Saint Laurent,T-Shirts,Men,destroyed jacket in sky blue denim,https://saint-laurent.dam.kering.com/m/5bef1da0c9ef87ca/Thumbnail-627584Y820L4669_A.jpg?v=2,9500
123,Saint Laurent,T-Shirts,Men,fitted jacket in dirty sandy blue denim,https://saint-laurent.dam.kering.com/m/4420d3f55b19c397/Thumbnail-597085Y502V4781_A.jpg?v=2,8900
124,Saint Laurent,T-Shirts,Men,fitted jacket in dark dirty vintage blue denim,https://saint-laurent.dam.kering.com/m/4affc76f84b9124d/Thumbnail-597085YYS074160_A.jpg?v=3,8900
125,Saint Laurent,T-Shirts,Men,classic jacket in deep vintage blue denim,https://saint-laurent.dam.kering.com/m/3efdde0e3f94493f/Thumbnail-597064YC8684255_A.jpg?v=3,8900
126,Saint Laurent,T-Shirts,Men,destroyed jean jacket in repaired dirty blue denim,https://saint-laurent.dam.kering.com/m/481ea5a7da7c3e30/Thumbnail-651610Y32AB4015_A.jpg?v=2,9500
127,Saint Laurent,T-Shirts,Men,destroyed fitted jacket in rodeo blue denim,https://saint-laurent.dam.kering.com/m/17765e4043d804b8/Thumbnail-601710Y883Y4501_A.jpg?v=1,8900
128,Saint Laurent,T-Shirts,Men,destroyed jacket in '70s blue trash denim,https://saint-laurent.dam.kering.com/m/18284e330db1e7d5/Thumbnail-596908YE9574342_A.jpg?v=3,13500
129,Saint Laurent,T-Shirts,Men,50s jacket in sun dirty blue denim,https://saint-laurent.dam.kering.com/m/631b5086cc174d5b/Thumbnail-625282Y00WA4987_A.jpg?v=2,13500
130,Saint Laurent,T-Shirts,Men,fitted jacket in gray off-white denim,https://saint-laurent.dam.kering.com/m/62c606d1248ddb91/Thumbnail-597085Y01KB9029_A.jpg?v=3,9800
131,Saint Laurent,T-Shirts,Men,fitted jacket in blue and pink dégradé denim,https://saint-laurent.dam.kering.com/m/16a3411b3bf8a130/Thumbnail-597085Y02IA4021_A.jpg?v=2,9500
132,Saint Laurent,T-Shirts,Men,western shirt in dirty medium vintage blue,https://saint-laurent.dam.kering.com/m/b2a221d09fd8e02/Thumbnail-498101Y880L4363_A.jpg,4990
133,Saint Laurent,T-Shirts,Men,western shirt in deep vintage blue denim,https://saint-laurent.dam.kering.com/m/2dea7b60e455d9c4/Thumbnail-597059Y880U4255_A.jpg?v=3,5590
134,Saint Laurent,T-Shirts,Men,classic western shirt in lightly coated black denim,https://saint-laurent.dam.kering.com/m/45598a402586e7b5/Thumbnail-597061Y881U1251_A.jpg,6290
135,Saint Laurent,T-Shirts,Men,western shirt in black rinse denim,https://saint-laurent.dam.kering.com/m/33178d765ab38e7c/Thumbnail-597059YM8811078_A.jpg?v=3,4990
136,Saint Laurent,T-Shirts,Men,western shirt in beige stonewashed denim,https://saint-laurent.dam.kering.com/m/ab33f48eac23ac7/Thumbnail-597059Y27BB9241_A.jpg?v=3,5590
137,Saint Laurent,T-Shirts,Men,western shirt in khaki stonewashed denim,https://saint-laurent.dam.kering.com/m/7613eee89eb49d56/Thumbnail-597059Y27BA3256_A.jpg?v=4,5590
138,Saint Laurent,T-Shirts,Men,distressed classic western shirt in khaki stonewashed denim,https://saint-laurent.dam.kering.com/m/18694c8ec07f3f99/Thumbnail-629966Y596V3253_A.jpg?v=3,5990
139,Saint Laurent,T-Shirts,Men,distressed western shirt in dirty sky blue denim,https://saint-laurent.dam.kering.com/m/2bc240a703161a6a/Thumbnail-651162Y24AB4679_A.jpg?v=2,6290
140,Saint Laurent,T-Shirts,Men,western shirt in dirty light blue stonewashed chambray,https://saint-laurent.dam.kering.com/m/7544a3634bcc33ca/Thumbnail-597059Y01IC4027_A.jpg?v=2,4690
141,Saint Laurent,T-Shirts,Men,long shirt in blue-gray vintage denim,https://saint-laurent.dam.kering.com/m/47b7647126db8a75/Thumbnail-652047Y02GA4018_A.jpg?v=2,4390
142,Saint Laurent,T-Shirts,Men,army shirt in wool check,https://saint-laurent.dam.kering.com/m/77ea8f1a1cf658a0/Thumbnail-637169Y00JA9704_A.jpg?v=2,5990
143,Saint Laurent,T-Shirts,Men,western shirt in vintage floral ikat cotton,https://saint-laurent.dam.kering.com/m/4b3fec0e3bc52c8/Thumbnail-644064Y01HA9757_A.jpg?v=2,5990
144,Saint Laurent,T-Shirts,Men,straight-fit jeans in dyed black denim,https://saint-laurent.dam.kering.com/m/29e7d1e29767394b/Thumbnail-625675Y867C1762_A.jpg?v=2,4990
145,Saint Laurent,T-Shirts,Men,skinny-fit jeans in used black denim,https://saint-laurent.dam.kering.com/m/33e20fbfcaeb74ba/Thumbnail-527389YO5001080_A.jpg?v=4,4690
146,Saint Laurent,T-Shirts,Men,skinny-fit jeans in silver-coated black stretch denim,https://saint-laurent.dam.kering.com/m/202cb0181f1c9e81/Thumbnail-622876Y500R1770_A.jpg?v=3,4990
147,Saint Laurent,T-Shirts,Men,skinny jeans in lightly coated black stretch denim,https://saint-laurent.dam.kering.com/m/7c74b142dcaf3a19/Thumbnail-622876YZ8901251_A.jpg?v=2,5990
148,Saint Laurent,T-Shirts,Men,skinny-fit jeans in worn black stretch denim,https://saint-laurent.dam.kering.com/m/6ea83940b6258061/Thumbnail-527389YS5001220_A.jpg?v=3,4390
149,Saint Laurent,T-Shirts,Men,slim-fit jeans in worn black stretch denim,https://saint-laurent.dam.kering.com/m/700cd6d077e99402/Thumbnail-526881YF8991220_A.jpg?v=1,4390
150,Saint Laurent,T-Shirts,Men,skinny-fit jeans in coated black denim,https://saint-laurent.dam.kering.com/m/1f2d4462f2a4c6b6/Thumbnail-527389Y824K1076_A.jpg,4690
151,Saint Laurent,T-Shirts,Men,cropped skinny-fit jeans in used black stretch denim,https://saint-laurent.dam.kering.com/m/5faad3ac3eeb265c/Thumbnail-601478YO5001080_A.jpg,4690
152,Saint Laurent,T-Shirts,Men,slim-fit jeans in worn black denim,https://saint-laurent.dam.kering.com/m/33008c4f229924a9/Thumbnail-597052YF8991220_A.jpg?v=3,4390
153,Saint Laurent,T-Shirts,Men,carrot-fit jeans in used black denim,https://saint-laurent.dam.kering.com/m/a4c5b3b18b1999c/Thumbnail-644678YY8991080_A.jpg?v=2,5590
154,Saint Laurent,T-Shirts,Men,slim-fit jeans in vintage dirty gray denim,https://saint-laurent.dam.kering.com/m/767f17a4aad957da/Thumbnail-597052Y823D1284_A.jpg?v=2,5990
155,Saint Laurent,T-Shirts,Men,tokyo black stretch denim skinny jeans,https://saint-laurent.dam.kering.com/m/54ab93ebdae65c43/Thumbnail-548400YT5001160_A.jpg?v=2,5550
