ID,Brand,Category,Gender,Name,Image URL,Price
1975,Saint Laurent,Accessories,Women,smoking twisted heart hoop earrings in metal and crystal,https://saint-laurent.dam.kering.com/m/5ec0c7aab185b5c1/Thumbnail-644803Y15268368_A.jpg?v=2,3950
1976,Saint Laurent,Accessories,Women,smoking crystal heart hoop earrings in metal,https://saint-laurent.dam.kering.com/m/45515b4c9dd4a963/Thumbnail-644802Y15268368_A.jpg?v=2,7950
1977,Saint Laurent,Accessories,Women,orchid drop earrings in metal,https://saint-laurent.dam.kering.com/m/6c315662277355ba/Thumbnail-650150Y15008062_A.jpg?v=2,2950
1978,Saint Laurent,Accessories,Women,orchid drop earrings in metal,https://saint-laurent.dam.kering.com/m/2a4e6f93ecff7ad0/Thumbnail-650150Y15008142_A.jpg?v=2,2950
1979,Saint Laurent,Accessories,Women,pineapple drop earrings in metal,https://saint-laurent.dam.kering.com/m/79e7108dd9598ac4/Thumbnail-650146Y15008142_A.jpg?v=2,2950
1980,Saint Laurent,Accessories,Women,opyum ysl threader earrings in metal,https://saint-laurent.dam.kering.com/m/3f9bbf697037fdb6/Thumbnail-618031Y15008030_A.jpg?v=1,2750
1981,Saint Laurent,Accessories,Women,opyum ysl threader earrings in metal,https://saint-laurent.dam.kering.com/m/539e28f51e2de59b/Thumbnail-618031Y15008126_A.jpg?v=1,2750
1982,Saint Laurent,Accessories,Women,opyum ysl threader earrings in metal,https://saint-laurent.dam.kering.com/m/3036bc7eb7bc0e58/Thumbnail-618031Y15008096_A.jpg?v=1,2750
1983,Saint Laurent,Accessories,Women,opyum ysl long threader earrings in metal,https://saint-laurent.dam.kering.com/m/6adc691a848ea3c8/Thumbnail-635450Y15008030_A.jpg?v=4,2950
1984,Saint Laurent,Accessories,Women,opyum ysl long threader earrings in metal,https://saint-laurent.dam.kering.com/m/11cb87b310d17e67/Thumbnail-635450Y15008126_A.jpg?v=2,2950
1985,Saint Laurent,Accessories,Women,opyum ysl long threader earrings in metal,https://saint-laurent.dam.kering.com/m/7ce45b4410dbdcc1/Thumbnail-635450Y15008096_A.jpg?v=3,2950
1986,Saint Laurent,Accessories,Women,monogram ear cuff in metal and crystals,https://saint-laurent.dam.kering.com/m/25e8a1cb74888852/Thumbnail-651778Y15268162_A.jpg?v=2,2250
1987,Saint Laurent,Accessories,Women,monogram ear cuff in metal,https://saint-laurent.dam.kering.com/m/5d9d201c7893bdad/Thumbnail-651778Y15008030_A.jpg?v=2,1950
1988,Saint Laurent,Accessories,Women,monogram ear cuff in metal,https://saint-laurent.dam.kering.com/m/4fc55cfaec47d685/Thumbnail-651778Y15008126_A.jpg?v=2,1950
1989,Saint Laurent,Accessories,Women,loulou earrings with chain tassels in light gold-colored brass,https://saint-laurent.dam.kering.com/m/46037d4811eba9d0/Thumbnail-506030Y16148045_A.jpg?v=5,2950
1990,Saint Laurent,Accessories,Women,loulou earrings with chain tassels in silver brass,https://saint-laurent.dam.kering.com/m/42ccf73f79b36ede/Thumbnail-506030Y16148142_A.jpg?v=4,2950
1991,Saint Laurent,Accessories,Women,star earrings with brass chains,https://saint-laurent.dam.kering.com/m/6d6cb9ab418bc4aa/Thumbnail-556501Y15ST8162_A.jpg?v=6,4950
1992,Saint Laurent,Accessories,Women,opyum ysl heart earrings in metal and crystal,https://saint-laurent.dam.kering.com/m/2140cc567fa2c9c/Thumbnail-584228Y15268052_A.jpg?v=4,5950
1993,Saint Laurent,Accessories,Women,opyum ysl heart earrings in metal and crystal,https://saint-laurent.dam.kering.com/m/1e25b29ba5d78665/Thumbnail-584228Y15268368_A.jpg?v=2,5950
1994,Saint Laurent,Accessories,Women,opyum ysl heart earrings in metal and crystal,https://saint-laurent.dam.kering.com/m/6f0ddb4b8bfd76bb/Thumbnail-652837Y15268131_A.jpg?v=3,5950
1995,Saint Laurent,Accessories,Women,"seashell charm necklace in metal, shells and wood",https://saint-laurent.dam.kering.com/m/789d46a1816d1c85/Thumbnail-649745Y15CB1062_A.jpg?v=2,6950
1996,Saint Laurent,Accessories,Women,"seashell charm necklace in metal, seashells and wood",https://saint-laurent.dam.kering.com/m/12d744eda739e29c/Thumbnail-647169Y15CB9145_A.jpg?v=2,6950
1997,Saint Laurent,Accessories,Women,beaded chain necklace in metal,https://saint-laurent.dam.kering.com/m/4983a5e76f2cbe2a/Thumbnail-649355Y15008142_A.jpg?v=2,3950
1998,Saint Laurent,Accessories,Women,dragonfly pendant necklace in metal and rock crystal,https://saint-laurent.dam.kering.com/m/768dfa1f5ecf5c10/Thumbnail-660822Y15059223_A.jpg?v=1,12950
1999,Saint Laurent,Accessories,Women,tassel necklace in metal,https://saint-laurent.dam.kering.com/m/784e8ccbf0022f4b/Thumbnail-660794Y15008060_A.jpg?v=1,7950
2000,Saint Laurent,Accessories,Women,t-bar necklace in metal,https://saint-laurent.dam.kering.com/m/307492ad675b84bd/Thumbnail-652761Y15008030_A.jpg?v=1,5950
2001,Saint Laurent,Accessories,Women,floral butterfly coiled necklace in metal and crystal,https://saint-laurent.dam.kering.com/m/682e92bc7faf4de2/Thumbnail-652328Y15268056_A.jpg?v=4,12950
2002,Saint Laurent,Accessories,Women,wreath necklace in metal and crystal,https://saint-laurent.dam.kering.com/m/31e7a3268037be74/Thumbnail-656456Y15269181_A.jpg?v=1,12950
2003,Saint Laurent,Accessories,Women,coiled necklace in metal,https://saint-laurent.dam.kering.com/m/7181d5fab76e5929/Thumbnail-658187Y15008069_A.jpg?v=1,6950
2004,Saint Laurent,Accessories,Women,two-tone chain necklace in metal,https://saint-laurent.dam.kering.com/m/49b12d20ff41d80e/Thumbnail-635704Y15008035_A.jpg?v=4,5950
2005,Saint Laurent,Accessories,Women,metal curb chain necklace,https://saint-laurent.dam.kering.com/m/e6eed867ea6fe7b/Thumbnail-593119Y15008142_A.jpg?v=2,5950
2006,Saint Laurent,Accessories,Women,cable-chain necklace with heart clasp,https://saint-laurent.dam.kering.com/m/123c27c4a217f28/Thumbnail-650639Y15008030_A.jpg?v=2,4950
2007,Saint Laurent,Accessories,Women,monogram link chain necklace,https://saint-laurent.dam.kering.com/m/23b0014f45d1a939/Thumbnail-646266Y15008142_A.jpg?v=2,5950
2008,Saint Laurent,Accessories,Women,triple-strand crystal necklace in metal,https://saint-laurent.dam.kering.com/m/53962f3991cd9113/Thumbnail-652343Y15268368_A.jpg?v=2,5950
2009,Saint Laurent,Accessories,Women,small metal cable-chain necklace,https://saint-laurent.dam.kering.com/m/5f23bde124c7a75d/Thumbnail-637486Y15008030_A.jpg,2450
2010,Saint Laurent,Accessories,Women,small graduated chain necklace,https://saint-laurent.dam.kering.com/m/70c14086f9d1fa26/Thumbnail-647201Y15008030_A.jpg?v=4,7950
2011,Saint Laurent,Accessories,Women,lobster pendant necklace in metal,https://saint-laurent.dam.kering.com/m/e21311c410868a0/Thumbnail-653358Y15008069_A.jpg?v=1,3450
2012,Saint Laurent,Accessories,Women,lobster pendant necklace in metal,https://saint-laurent.dam.kering.com/m/54197ed16c7ebba7/Thumbnail-653358Y15008142_A.jpg?v=1,3450
2013,Saint Laurent,Accessories,Women,strawberries bolo necklace in metal and enamel,https://saint-laurent.dam.kering.com/m/531c59b70854e86b/Thumbnail-658707Y15219178_A.jpg?v=2,3950
2014,Saint Laurent,Accessories,Women,strawberry long pendant necklace in metal and enamel,https://saint-laurent.dam.kering.com/m/585544a0f68620e6/Thumbnail-658699Y15219178_A.jpg?v=1,3450
2015,Saint Laurent,Accessories,Women,long cherry pendant necklace in metal and enamel,https://saint-laurent.dam.kering.com/m/75e966dbcb65f299/Thumbnail-652354Y14169119_A.jpg?v=2,3950
2016,Saint Laurent,Accessories,Women,scorpion pendant necklace in metal,https://saint-laurent.dam.kering.com/m/3cb5603c2b5fab47/Thumbnail-653353Y15008069_A.jpg?v=1,3450
2017,Saint Laurent,Accessories,Women,scorpion pendant necklace in metal,https://saint-laurent.dam.kering.com/m/20948f84b51b268b/Thumbnail-653353Y15008142_A.jpg?v=1,3450
2018,Saint Laurent,Accessories,Women,auger seashell pendant necklace in metal,https://saint-laurent.dam.kering.com/m/411299f9c32949c1/Thumbnail-649383Y15008142_A.jpg?v=2,2750
2019,Saint Laurent,Accessories,Women,palm leaf pendant necklace in metal,https://saint-laurent.dam.kering.com/m/7eb8ebc339243386/Thumbnail-647155Y15008062_A.jpg?v=2,2750
2020,Saint Laurent,Accessories,Women,palm leaf pendant necklace in metal,https://saint-laurent.dam.kering.com/m/fd5d1f9d9701ece/Thumbnail-647155Y15008142_A.jpg?v=2,2750
2021,Saint Laurent,Accessories,Women,cactus pendant necklace in metal,https://saint-laurent.dam.kering.com/m/3770cc06d275c32c/Thumbnail-649981Y15008142_A.jpg?v=2,2750
2022,Saint Laurent,Accessories,Women,seashell pendant necklace in metal,https://saint-laurent.dam.kering.com/m/2c504a667e992503/Thumbnail-652393Y15009176_A.jpg?v=2,2950
2023,Saint Laurent,Accessories,Women,orchid pendant necklace in metal,https://saint-laurent.dam.kering.com/m/2f0480455cb5bcbb/Thumbnail-647157Y15008142_A.jpg?v=2,2750
2024,Saint Laurent,Accessories,Women,pineapple pendant necklace in metal,https://saint-laurent.dam.kering.com/m/36918aa6cf5a438/Thumbnail-646034Y15008142_A.jpg?v=2,2750
2025,Saint Laurent,Accessories,Women,pineapple pendant necklace in metal,https://saint-laurent.dam.kering.com/m/f13ab95d9da7a49/Thumbnail-646060Y15008062_A.jpg?v=4,2950
2026,Saint Laurent,Accessories,Women,mini heart pendant necklace in metal,https://saint-laurent.dam.kering.com/m/7aebf253efb27ccf/Thumbnail-632310Y15008060_A.jpg?v=5,2450
2027,Saint Laurent,Accessories,Women,mini heart pendant necklace in metal,https://saint-laurent.dam.kering.com/m/4a8fc5cdb4db968/Thumbnail-632310Y15008142_A.jpg?v=3,2450
2028,Saint Laurent,Accessories,Women,monogram twist pendant necklace in metal,https://saint-laurent.dam.kering.com/m/4bd7cc8d91b7b6df/Thumbnail-651779Y15008030_A.jpg?v=2,2950
2029,Saint Laurent,Accessories,Women,monogram twist pendant necklace in metal,https://saint-laurent.dam.kering.com/m/155b5e857ee902fa/Thumbnail-651779Y15008126_A.jpg?v=2,2950
2030,Saint Laurent,Accessories,Women,double id tag necklace,https://saint-laurent.dam.kering.com/m/41880b18510f3a99/Thumbnail-533552Y15008060_A.jpg?v=3,2950
2031,Saint Laurent,Accessories,Women,medallion pendant necklace in metal,https://saint-laurent.dam.kering.com/m/1b1ced8fb9ff4968/Thumbnail-650114Y15008142_A.jpg?v=2,2750
2032,Saint Laurent,Accessories,Women,landscape heart pendant necklace in metal,https://saint-laurent.dam.kering.com/m/66c746d62bebc4c4/Thumbnail-647218Y15TO9130_A.jpg?v=2,3450
2033,Saint Laurent,Accessories,Women,moon pendant necklace in metal,https://saint-laurent.dam.kering.com/m/3d161b20505f2e85/Thumbnail-622692Y15008030_A.jpg,3450
2034,Saint Laurent,Accessories,Women,surfer duo pendant necklace in metal,https://saint-laurent.dam.kering.com/m/c3b2e7ddc965497/Thumbnail-647604Y15008142_A.jpg?v=2,2950
2035,Saint Laurent,Accessories,Women,"seashell dagger pendant necklace in leather, shell and metal",https://saint-laurent.dam.kering.com/m/4a50b70343624a40/Thumbnail-6493281V69D1020_A.jpg?v=2,1950
2036,Saint Laurent,Accessories,Women,surfboard pendant necklace in metal and wood,https://saint-laurent.dam.kering.com/m/4025ecb15302b962/Thumbnail-647602Y15108110_A.jpg?v=2,3450
2037,Saint Laurent,Accessories,Women,bamboo square bangle in metal and wood,https://saint-laurent.dam.kering.com/m/7dfea9a8168ca1fb/Thumbnail-647160Y15108122_A.jpg?v=2,2950
2038,Saint Laurent,Accessories,Women,stars & love woven heart bracelet in smooth leather and metal,https://saint-laurent.dam.kering.com/m/697f9afde7142caf/Thumbnail-634490BL44J1000_A.jpg?v=3,2950
2039,Saint Laurent,Accessories,Women,stars & love woven heart bracelet in smooth leather and metal,https://saint-laurent.dam.kering.com/m/5ba397aebaf92dd/Thumbnail-634490BL44D1000_A.jpg?v=3,2950
2040,Saint Laurent,Accessories,Women,woven heart bracelet in smooth leather and metal,https://saint-laurent.dam.kering.com/m/3d62f776e205d26d/Thumbnail-634490BL44U1000_A.jpg?v=5,2950
2041,Saint Laurent,Accessories,Women,woven diagonal leather and cord bracelet,https://saint-laurent.dam.kering.com/m/4bb3753ef7c9ca98/Thumbnail-649409DXS6B1020_A.jpg?v=2,2450
2042,Saint Laurent,Accessories,Women,"cowrie shell bracelet in leather, seashell and metal",https://saint-laurent.dam.kering.com/m/7c98b832d3d87e51/Thumbnail-6522981V6EN1020_A.jpg?v=3,2450
2043,Saint Laurent,Accessories,Women,"cowrie shell bracelet in leather, seashell and metal",https://saint-laurent.dam.kering.com/m/796f9f4bc04b8fda/Thumbnail-6494461V6DJ1020_A.jpg?v=2,2950
2044,Saint Laurent,Accessories,Women,"flower bracelet in leather, beads and metal",https://saint-laurent.dam.kering.com/m/313c3593ba75d22d/Thumbnail-6493181V68D1000_A.jpg?v=3,2950
2045,Saint Laurent,Accessories,Women,braided leather and passementerie seashell monogram bracelet,https://saint-laurent.dam.kering.com/m/6b4d5e6f0d28cd36/Thumbnail-649457G257D1000_A.jpg?v=4,3450
2046,Saint Laurent,Accessories,Women,braided leather and passementerie seashell monogram bracelet,https://saint-laurent.dam.kering.com/m/2f90312c688a7241/Thumbnail-649457G257W1000_A.jpg?v=4,3450
2047,Saint Laurent,Accessories,Women,braided leather and passementerie seashell monogram bracelet,https://saint-laurent.dam.kering.com/m/69d9c113e5ebf572/Thumbnail-649457G257D9207_A.jpg?v=2,3450
2048,Saint Laurent,Accessories,Women,braided leather and passementerie pineapple monogram bracelet,https://saint-laurent.dam.kering.com/m/73f3ddacd730ba8a/Thumbnail-649456G257D1000_A.jpg?v=2,3450
2049,Saint Laurent,Accessories,Women,cherries & leaves charm bracelet in metal,https://saint-laurent.dam.kering.com/m/4354b2ae1f56a10e/Thumbnail-654616Y15008069_A.jpg?v=1,4950
2050,Saint Laurent,Accessories,Women,strawberry charm bracelet in metal and enamel,https://saint-laurent.dam.kering.com/m/133128d14c106e09/Thumbnail-658708Y15219178_A.jpg?v=1,4950
2051,Saint Laurent,Accessories,Women,two-tone chain bracelet in metal,https://saint-laurent.dam.kering.com/m/5589048b24d0fd30/Thumbnail-635705Y15008035_A.jpg?v=5,3950
2052,Saint Laurent,Accessories,Women,woven chain beaded bracelet in metal,https://saint-laurent.dam.kering.com/m/489f24dc8cef2ecd/Thumbnail-645072Y15008142_A.jpg?v=2,2950
2053,Saint Laurent,Accessories,Women,id bracelet in metal,https://saint-laurent.dam.kering.com/m/2a36ab218bad6660/Thumbnail-646671Y15008030_A.jpg?v=2,3250
2054,Saint Laurent,Accessories,Women,id bracelet in metal,https://saint-laurent.dam.kering.com/m/5ceaf79c8c7c11e7/Thumbnail-646671Y15008126_A.jpg?v=2,3250
2055,Saint Laurent,Accessories,Women,"seashell charm bracelet in metal, shells and wood",https://saint-laurent.dam.kering.com/m/7b2b348143212143/Thumbnail-649744Y15CB1062_A.jpg?v=3,3950
2056,Saint Laurent,Accessories,Women,"seashell charm bracelet in metal, shells and wood",https://saint-laurent.dam.kering.com/m/77c134f084d2c85a/Thumbnail-649744Y15CB9145_A.jpg?v=2,3950
2057,Saint Laurent,Accessories,Women,hawaiian charm bracelet in metal,https://saint-laurent.dam.kering.com/m/178cce64bcf9134b/Thumbnail-647442Y15008062_A.jpg?v=2,3950
2058,Saint Laurent,Accessories,Women,articulated wave bracelet in metal and enamel,https://saint-laurent.dam.kering.com/m/1895cf40ec935e8e/Thumbnail-646235Y15218110_A.jpg?v=4,9950
2059,Saint Laurent,Accessories,Women,pineapple link bracelet in metal,https://saint-laurent.dam.kering.com/m/974595111eef8d9/Thumbnail-650136Y15008142_A.jpg?v=2,4950
2060,Saint Laurent,Accessories,Women,obsidian cabochon articulated bracelet in metal,https://saint-laurent.dam.kering.com/m/2db170f618146045/Thumbnail-646236Y15OB8110_A.jpg?v=4,9950
2061,Saint Laurent,Accessories,Women,small graduated chain bracelet,https://saint-laurent.dam.kering.com/m/1e1eba6d1065d361/Thumbnail-649393Y15008030_A.jpg?v=2,5950
2062,Saint Laurent,Accessories,Women,sahara chain bracelet,https://saint-laurent.dam.kering.com/m/56a41f1238f4d6d6/Thumbnail-647162Y15008062_A.jpg?v=1,3950
2063,Saint Laurent,Accessories,Women,sahara chain bracelet,https://saint-laurent.dam.kering.com/m/18e3c2c5b0195913/Thumbnail-647162Y15008142_A.jpg?v=2,3950
2064,Saint Laurent,Accessories,Women,monogram link chain bracelet,https://saint-laurent.dam.kering.com/m/8ac94dcedacc48b/Thumbnail-649773Y15008142_A.jpg?v=2,3950
2065,Saint Laurent,Accessories,Women,mini graduated chain bracelet,https://saint-laurent.dam.kering.com/m/46d625226f2aa0fd/Thumbnail-649731Y15008142_A.jpg?v=2,3450
2066,Saint Laurent,Accessories,Women,mini graduated chain bracelet,https://saint-laurent.dam.kering.com/m/62c2984ef21b2c59/Thumbnail-649731Y15008030_A.jpg?v=2,3450
2067,Saint Laurent,Accessories,Women,t-bar bracelet in metal,https://saint-laurent.dam.kering.com/m/4075a0af187ac597/Thumbnail-652764Y15008030_A.jpg?v=4,3450
2068,Saint Laurent,Accessories,Women,small twist cuff bracelet in metal,https://saint-laurent.dam.kering.com/m/6c6f02df8266e043/Thumbnail-649734Y15008469_A.jpg?v=2,3250
2069,Saint Laurent,Accessories,Women,feather cuff bracelet in metal,https://saint-laurent.dam.kering.com/m/4ff05334b2645684/Thumbnail-650889Y15008069_A.jpg?v=2,2750
2070,Saint Laurent,Accessories,Women,feather cuff bracelet in metal,https://saint-laurent.dam.kering.com/m/241ace06870b4d8b/Thumbnail-650889Y15008142_A.jpg?v=2,2750
2071,Saint Laurent,Accessories,Women,small snake twist cuff bracelet in metal,https://saint-laurent.dam.kering.com/m/6a7a0cb71da02bac/Thumbnail-649742Y15008142_A.jpg?v=2,3250
2072,Saint Laurent,Accessories,Women,engraved flower cuff bracelet in wood,https://saint-laurent.dam.kering.com/m/59337c284caffda4/Thumbnail-646646Y18001000_A.jpg?v=2,10950
2073,Saint Laurent,Accessories,Women,large twist cuff bracelet in metal,https://saint-laurent.dam.kering.com/m/61f5e7d8448b3d18/Thumbnail-647202Y15008469_A.jpg?v=2,4450
2074,Saint Laurent,Accessories,Women,beaded chain bracelet in metal,https://saint-laurent.dam.kering.com/m/a0683bb65c82074/Thumbnail-649352Y15008142_A.jpg?v=2,2950
2075,Saint Laurent,Accessories,Women,opyum bracelet in crinkled leather and metal,https://saint-laurent.dam.kering.com/m/10ebcdf6cca83d41/Thumbnail-6073190UZ0D1000_A.jpg?v=2,1450
2076,Saint Laurent,Accessories,Women,"skull and shell bracelet in metal, leather and seashells",https://saint-laurent.dam.kering.com/m/268dfa4d67dace05/Thumbnail-650204Y15CC1061_A.jpg?v=2,3950
2077,Saint Laurent,Accessories,Women,torc bracelet in feathers and metal,https://saint-laurent.dam.kering.com/m/3d7d1f059edf5c07/Thumbnail-649363Y15PN9139_A.jpg?v=3,12950
2078,Saint Laurent,Accessories,Women,torc bracelet in feathers and metal,https://saint-laurent.dam.kering.com/m/44c0ffcf8ac5d911/Thumbnail-649363Y15PN8109_A.jpg?v=2,12950
2079,Saint Laurent,Accessories,Women,torc bracelet in feathers and metal,https://saint-laurent.dam.kering.com/m/d908b546a744f44/Thumbnail-649363Y15PN9138_A.jpg?v=2,12950
2080,Saint Laurent,Accessories,Women,torc necklace in feathers and metal,https://saint-laurent.dam.kering.com/m/5e8f11e771e2304c/Thumbnail-644815Y15PN9138_A.jpg?v=3,14950
2081,Saint Laurent,Accessories,Women,scroll-chain bracelet in metal,https://saint-laurent.dam.kering.com/m/3f8a4ab14504ced3/Thumbnail-625925Y15008142_A.jpg,2750
2082,Saint Laurent,Accessories,Women,figaro-chain bracelet in metal,https://saint-laurent.dam.kering.com/m/54ca7ba62df3cb23/Thumbnail-625938Y15008142_A.jpg?v=3,2750
2083,Saint Laurent,Accessories,Women,smoking crystal anklet in metal,https://saint-laurent.dam.kering.com/m/69d37370cb2b767f/Thumbnail-637495Y15268368_A.jpg?v=4,2950
2084,Saint Laurent,Accessories,Women,small metal cable-chain bracelet,https://saint-laurent.dam.kering.com/m/174470e51a45bd43/Thumbnail-637431Y15008030_A.jpg,1950
2085,Saint Laurent,Accessories,Women,charm bracelet in gold brass,https://saint-laurent.dam.kering.com/m/5891fd374d80056f/Thumbnail-635533Y15008096_A.jpg?v=1,1950
2086,Saint Laurent,Accessories,Women,charm bracelet in silver brass,https://saint-laurent.dam.kering.com/m/7912f8b8449aa54e/Thumbnail-635533Y15008126_A.jpg?v=4,1950
2087,Saint Laurent,Accessories,Women,charm bracelet in gold brass,https://saint-laurent.dam.kering.com/m/2845f1fdfe40ab12/Thumbnail-635533Y15008030_A.jpg?v=3,1950
2088,Saint Laurent,Accessories,Women,small faceted cable-chain bracelet,https://saint-laurent.dam.kering.com/m/6af136f88b3e3e28/Thumbnail-601757Y15008030_A.jpg?v=1,1750
2089,Saint Laurent,Accessories,Women,metal curb chain bracelet,https://saint-laurent.dam.kering.com/m/51e3a5cb808738d3/Thumbnail-586467Y15008142_A.jpg?v=4,3950
2090,Saint Laurent,Accessories,Women,palm cuff bracelet in tortoiseshell resin,https://saint-laurent.dam.kering.com/m/27f8d673fe8ca3ee/Thumbnail-646663Y20001362_A.jpg?v=2,5950
2091,Saint Laurent,Accessories,Women,monogram cuff bracelet in striated brass,https://saint-laurent.dam.kering.com/m/34089e74ffdf440d/Thumbnail-584060Y15008142_A.jpg?v=1,5950
2092,Saint Laurent,Accessories,Women,monogram cuff bracelet in striated brass,https://saint-laurent.dam.kering.com/m/137b836316faedca/Thumbnail-584060Y15008060_A.jpg?v=1,5950
2093,Saint Laurent,Accessories,Women,opyum double wrap bracelet in leather and gold-toned metal,https://saint-laurent.dam.kering.com/m/3308699f5961f3af/Thumbnail-536073BOO0J1000_A.jpg?v=3,2750
2094,Saint Laurent,Accessories,Women,opyum double wrap bracelet in shiny crocodile-embossed leather and metal,https://saint-laurent.dam.kering.com/m/dd75c7290f9eba8/Thumbnail-5360731ZQ0J2053_A.jpg?v=4,2750
2095,Saint Laurent,Accessories,Women,opyum double wrap bracelet in red leather and gold-tone metal,https://saint-laurent.dam.kering.com/m/6aa2d48f0b4f2af2/Thumbnail-536073BL40J6805_A.jpg?v=3,2750
2096,Saint Laurent,Accessories,Women,opyum double wrap bracelet in vintage lambskin,https://saint-laurent.dam.kering.com/m/523091ff837cd2e8/Thumbnail-646558BL40J9207_A.jpg?v=3,2750
2097,Saint Laurent,Accessories,Women,opyum double wrap bracelet in smooth leather and metal ,https://saint-laurent.dam.kering.com/m/11260f3b0dfd47df/Thumbnail-6465580IH0U1000_A.jpg?v=2,2750
2098,Saint Laurent,Accessories,Women,opyum double-wrap bracelet in nubuck and metal,https://saint-laurent.dam.kering.com/m/7a97609d72f1ae5b/Thumbnail-53607311G0D1000_A.jpg?v=1,2750
2099,Saint Laurent,Accessories,Women,opyum double wrap bracelet in leather and silver-toned metal,https://saint-laurent.dam.kering.com/m/4a52a8666945b5cd/Thumbnail-536073BOO0E1000_A.jpg?v=3,2750
2100,Saint Laurent,Accessories,Women,opyum double-wrap bracelet in lacquered leather and metal,https://saint-laurent.dam.kering.com/m/7dc575cb76044ff9/Thumbnail-536073BOO0R1000_A.jpg?v=4,2750
2101,Saint Laurent,Accessories,Women,opyum bracelet in leather and metal,https://saint-laurent.dam.kering.com/m/1f1ad62977d2319/Thumbnail-559355BL40J6805_A.jpg?v=4,2250
2102,Saint Laurent,Accessories,Women,opyum bracelet in vintage leather and metal,https://saint-laurent.dam.kering.com/m/6b2800cc60cc4510/Thumbnail-55935505B3J9207_A.jpg?v=1,2250
2103,Saint Laurent,Accessories,Women,opyum bracelet in patent leather and metal,https://saint-laurent.dam.kering.com/m/1f51c9349bfec4bc/Thumbnail-559355AHG0J6805_A.jpg?v=7,2250
2104,Saint Laurent,Accessories,Women,opyum bracelet in smooth leather and metal,https://saint-laurent.dam.kering.com/m/495caec4d46e28f/Thumbnail-5593550IH0C1000_A.jpg?v=2,2250
2105,Saint Laurent,Accessories,Women,opyum bracelet in patent leather and metal,https://saint-laurent.dam.kering.com/m/67eb0300789d43d9/Thumbnail-559355AHG0N1000_A.jpg?v=8,2250
2106,Saint Laurent,Accessories,Women,opyum bracelet in smooth leather and metal,https://saint-laurent.dam.kering.com/m/4cc3f7aed11d2a0a/Thumbnail-5593550IH0U1000_A.jpg?v=3,2250
2107,Saint Laurent,Accessories,Women,opyum bracelet in suede and metal,https://saint-laurent.dam.kering.com/m/4eee399716faf7c2/Thumbnail-559355C0X0B2355_A.jpg?v=2,2250
2108,Saint Laurent,Accessories,Women,narrow multi-wrap saint laurent id bracelet in smooth leather and metal,https://saint-laurent.dam.kering.com/m/669b4db59d4bc9c0/Thumbnail-5137260IH0W1000_A.jpg?v=2,1950
2109,Saint Laurent,Accessories,Women,narrow multi-wrap saint laurent id bracelet in black leather and metal,https://saint-laurent.dam.kering.com/m/6d33a3dc9c05957e/Thumbnail-5137260IH0D1000_A.jpg?v=2,1950
2110,Saint Laurent,Accessories,Women,narrow multi-wrap id bracelet in leather and metal ,https://saint-laurent.dam.kering.com/m/5281b8fdf96eacf6/Thumbnail-5137260IH0U1000_A.jpg?v=2,1950
2111,Saint Laurent,Accessories,Women,"multi-strand bracelet in passementerie, leather, seashell and metal",https://saint-laurent.dam.kering.com/m/52cc16ac14a2cfa7/Thumbnail-649762G259D1020_A.jpg?v=3,2950
2112,Saint Laurent,Accessories,Women,"woven triangle bracelet in suede, leather and metal",https://saint-laurent.dam.kering.com/m/48a9ead627558d35/Thumbnail-649412C4B1B2358_A.jpg?v=2,2450
2113,Saint Laurent,Accessories,Women,"multi-strand bracelet in suede, seashell and metal",https://saint-laurent.dam.kering.com/m/2ecb0c5842495e0a/Thumbnail-64976211ZCB2374_A.jpg?v=2,2950
2114,Saint Laurent,Accessories,Women,saint laurent id plaque bracelet in smooth leather and metal,https://saint-laurent.dam.kering.com/m/219082ee7a68102e/Thumbnail-6053480IH0U1000_A.jpg?v=2,2250
2115,Saint Laurent,Accessories,Women,carré bracelet in leather and metal,https://saint-laurent.dam.kering.com/m/7db50e4064a8f876/Thumbnail-558104BOO0J1000_A.jpg?v=4,2950
2116,Saint Laurent,Accessories,Women,betty bracelet in leather and metal,https://saint-laurent.dam.kering.com/m/58d00cfa1107a0a5/Thumbnail-558104BOO0R1000_A.jpg?v=2,2950
2117,Saint Laurent,Accessories,Women,carré bracelet in leather and metal,https://saint-laurent.dam.kering.com/m/5430dc9797a21404/Thumbnail-558104BOO0E1000_A.jpg?v=3,2950
2118,Saint Laurent,Accessories,Women,le carré bracelet in leather and metal,https://saint-laurent.dam.kering.com/m/6f4f53f5180063e/Thumbnail-6514890IH0C1000_A.jpg?v=3,2950
2119,Saint Laurent,Accessories,Women,saint laurent id bracelet in leather and metal,https://saint-laurent.dam.kering.com/m/42d8c08baa29c125/Thumbnail-5420120IH0J1000_A.jpg?v=2,2450
2120,Saint Laurent,Accessories,Women,saint laurent id bracelet in smooth leather and metal,https://saint-laurent.dam.kering.com/m/4545d273b204bece/Thumbnail-5420120IH0E1000_A.jpg?v=2,2450
2121,Saint Laurent,Accessories,Women,saint laurent id plaque bracelet in smooth leather and metal,https://saint-laurent.dam.kering.com/m/54a66ba137c965b9/Thumbnail-5061480IH1C1000_A.jpg?v=1,1450
